product;section;key2
Платикодон махровый синий объем 0,5 л;садоводство;Платикодон
Плед флисовый 100% полиэстер 185х240 см бежевый, Wellness, WP184-Айленд_2;текстиль;Плед
Плед флисовый 150х130 см WELLNESS WPLNY135-Зима_10 100 % полиэстер;текстиль;Плед
Плед флисовый 200х150 см WELLNESS WPL152-Атланта_88 100 % полиэстер;текстиль;Плед
Плед флисовый 200х150 см WELLNESS WPLNY152-Зима_4 100 % полиэстер;текстиль;Плед
"Плечики пластмассовые (Размер 48 - 54 ) ""МП"", 1205160";хозяйственно-бытовые принадлежности;Плечики
Плечики пластмассовые Размер 48 - 54 МП 1205160;хозяйственно-бытовые принадлежности;Плечики
Плечики пластмассовые Размер 52 - 54 Тула 1205158;хозяйственно-бытовые принадлежности;Плечики
Подарочный набор на 8 Марта Гиацинты розовые 3 луковицы d-12 см в подарочной упаковке с открыткой;садоводство;Подарочный
Подарочный набор на 8 Марта Нарцисс 5 луковиц d-12 см с открыткой и мылом и удобрением в подарочном пакете;косметика и гигиена;Подарочный
Подарочный набор на 8 Марта Пеларгония белая d-12 см в подарочной упаковке с открыткой;садоводство;Подарочный
Подарочный набор на 8 Марта Пеларгония красная d-12 см в подарочной упаковке с открыткой;садоводство;Подарочный
Подарочный набор на 8 Марта Тюльпаны розовые 5 луковиц d-12 см в подарочной упаковке с открыткой;садоводство;Подарочный
Подвесное кашпо Бакопа ампельная мега-крупная смесь окрасок объем 4 л;садоводство;Подвесное
Подвесное кашпо Вербена микс Victoria смесь окрасок объем 4 л;садоводство;Подвесное
Подвесное кашпо Гелихризум серебристая объем 4 л;садоводство;Подвесное
Подвесное кашпо Дихондра серебристая объем 4 л;садоводство;Подвесное
Подвесное кашпо Калибрахоа Aloha Double Purple сиреневая махровая объем 4 л;садоводство;Подвесное
Подвесное кашпо Калибрахоа Aloha Kona Dark Red красная объем 4 л;садоводство;Подвесное
Подвесное кашпо Калибрахоа Confetti Mysweetheart смесь махровых окрасок объем 4 л;садоводство;Подвесное
Подвесное кашпо Калибрахоа Mini Famous Double Blue фиолетовая махровая объем 4 л;садоводство;Подвесное
Подвесное кашпо Калибрахоа Mini Famous Double Red красная махровая объем 4 л;садоводство;Подвесное
Подвесное кашпо Калибрахоя Snowberry белая объем 4 л;садоводство;Подвесное
Подвесное кашпо Лобелия Регатта Regatta микс объем 4 л;садоводство;Подвесное
Подвесное кашпо Пеларгония махровая Calliope Dark Red темно-красная объем 4 л;садоводство;Подвесное
Подвесное кашпо Пеларгония махровая Calliope Rose Splash розовая объем 4 л;садоводство;Подвесное
Подвесное кашпо Петуния Surprise White белая объем 4 л;садоводство;Подвесное
Подвесное кашпо Петуния микс смесь окрасок объем 4 л;садоводство;Подвесное
Подголовник Bacchetta 25х34 см Quadrifoglio 4809;хозяйственно-бытовые принадлежности;Подголовник
Подголовник для ванной комнаты из ПВХ 25х34 Mickey, Bacchetta, 4811;ванна;Подголовник
Подголовник для ванной комнаты из ПВХ 25х34 синий, Bacchetta, 1620;ванна;Подголовник
Подкладка под чехол Zalger 520114 135х50 см войлок;хозяйственно-бытовые принадлежности;Подкладка
Подкладка под чехол Zalger 520140 135х50 см поролон;хозяйственно-бытовые принадлежности;Подкладка
Пододеяльник 214х150 см WELLNESS RQ150-Кармен_В 100% хлопок;текстиль;Пододеяльник
Подрукавник Gimi Planet для гладильной доски;хозяйственно-бытовые принадлежности;Подрукавник
Подрукавник Leifheit Stabil для гладильной доски, 71816;хозяйственно-бытовые принадлежности;Подрукавник
Подрукавник складной Ника П;хозяйственно-бытовые принадлежности;Подрукавник
Подсолнечник низкорослый d-13 см;садоводство;Подсолнечник
Подставка для ножей ALPENKOK круглая из пластика 11*22 см красная AK-202ST;посуда;Подставка
Подставка для обуви резиновая Attribute 80x40 см AMC080;мебель;Подставка
Подставка для цветов 1-секционная Стелла 1205107;садоводство;Подставка
Подставка для яйца WILMAX WL-996004/A;посуда;Подставка для яйца
Подушка 40х40 см WELLNESS PLATINUM WR44T цвет в ассортименте;текстиль;Подушка
Подушка декоративная флисовая 100% полиэстер 40*40 см синяя клетка, Wellness, WP44-Атланта_34;текстиль;Подушка
Покрывало KARNA вельсофт с вышивкой DAMASK 200x220 см 9234567038126;текстиль;Покрывало
Покрывало жаккард KARNA стеганое KALVEN 260x260 см наволочки 50х70 см 2 шт 8681914002162;текстиль;Покрывало
Покрывало жаккард шенилл BIRHOME VALENTIN 240х260 см наволочки 50х70 см 2 шт 9234567089661;текстиль;Покрывало
Покрывало стеганый KARNA 200х220 см 9234567049108;текстиль;Покрывало
Покрытие для гладильной доски Airboard M Premium Speed , 125х40 см, Leifneit, арт. 72373;хозяйственно-бытовые принадлежности;Покрытие
Покрытие для гладильной доски Dressfix XL 140х40 см на веревке жасмин, Leifheit, 72328;хозяйственно-бытовые принадлежности;Покрытие
Покрытие для гладильной доски Leifheit Reflecta Speed Universal, 140х45 см. 72382;хозяйственно-бытовые принадлежности;Покрытие
Полка для обуви Hausmann 3 яруса 60х24,3х60 см сосна HM-3013;мебель;Полка
Полка для обуви Hausmann 70х27х40 см коричневый HM-3011;мебель;Полка
Полки QWERTY Барселона белый 28х28х15 см 23х23х15 см 17х17х15 см 72009;мебель;Полки
Полки QWERTY Берлин чёрный 44х24х10 см 40х20х10 см 36х16х10 см 72008;мебель;Полки
Полки QWERTY Италия белый/серый 40х14х10 см 35х10х10 см 30х7х10 см 72006;мебель;Полки
Полки QWERTY Лондон белый 27х27х10 см и 23х23х10 см 72000;мебель;Полки
Полки QWERTY Мадрид белый/чёрный 50х30х12 см 2 штуки и 30х24х12 см 2 штуки 72019;мебель;Полки
Полки QWERTY Нью-Йорк правый белый/голубой 44х24х10 см 40х20х10 см 36х16х10 см 72012;мебель;Полки
Полки QWERTY Пекин белый/чёрный 95х17,5х16 см 40х13х16 см 40х13х16 см 72017;мебель;Полки
Полки QWERTY Рио белый/чёрный 42,5х21х10 см 17х17х10 см 17х17х10 см 72005;мебель;Полки
Полки QWERTY Токио чёрный 30х30х10 см 25х25х10 см 20х20х10 см 15х15х10 см 72007;мебель;Полки
Полки QWERTY Торонто белый 40х10 см 35х10 см 30х10 см 25х10 см 72015;мебель;Полки
Половник Attribute BLOSSOM пластик AGB305;кухонные принадлежности;Половник
Полотенце кухонное Мила* mix, 100% хлопок 170 г/м2, 38х63,5 см, цвета в ассортименте, Wellness, 4630005366090;текстиль;Полотенце
Полотенце махровое Гармония, 100% хлопок 335 г/м2, 32х70 см, Wellness, 4630005362832;текстиль;Полотенце
Полотенце прессованное P46 Авто_2, 100% хлопок 278 г/м2, 30х60 см, Wellness, 4607101069064;ванна;Полотенце
Полотенце прессованное P48 Сердце_3, 100% хлопок 278 г/м2, 30х60 см, Wellness, 4607101069088;ванна;Полотенце
Портулак рассада однолетних цветов в кассете по 10 шт;садоводство;Портулак
Портулак рассада однолетних цветов в кассете по 6 шт;садоводство;Портулак
Пресс для чеснока Attribute WESTERN AGW050;кухонные принадлежности;Пресс
Примула акаулис Микс d-10 см;садоводство;Примула
Примула желтая с оранжевым в горшке d-10 см;садоводство;Примула
Примула комнатная D9 см красная;садоводство;Примула
Примула комнатная D9 см малиновая;садоводство;Примула
Примула комнатная D9 см розовая;садоводство;Примула
Примула комнатная D9 см фиолетовая;садоводство;Примула
Примула комнатная D9 см цвет в ассортименте;садоводство;Примула
Примула комнатная D9 см цвет фуксии;садоводство;Примула
Примула комнатная акаулис белая D10 см;садоводство;Примула
Примула комнатная акаулис красная D10 см;садоводство;Примула
Примула комнатная акаулис синяя D10 см;садоводство;Примула
Примула рассада однолетних цветов в кассете по 10 шт;садоводство;Примула
Прищепки для белья York Spring Prestige, 9603/Z027;хозяйственно-бытовые принадлежности;Прищепки
Пробка для ванны резиновая (Д-40 мм) 1206155;ванна;Пробка
Пробка для ванны резиновая с цепочкой 1206157;ванна;Пробка
Просеиватель для муки D27см., RSB;кухонные принадлежности;Просеиватель
Простынь вафельная 200х180 см WELLNESS RW180-01 100% хлопок;текстиль;Простынь
Простыня двуспальная 100% хлопок 200*214 см бело-сиреневая, Wellness, RP200-Ваниль_А;текстиль;Простыня
Простыня на резинке односпальная Wellness RM90-Арктик 100% хлопок, 90х200 см, белая;текстиль;Простыня
Простыня сатиновая полутороспальная Wellness RPE150-Дримс 100% хлопок, 150х214 см;текстиль;Простыня
Противень прямоугольный алюминиевый 340х240х25 см ЭКСПЕРТ, Scovo, СЭ-052, /1503028;кухонные принадлежности;Противень
Пружина дверная 240 мм оцинкованная (Д-19 мм) без крепления, 1107014;инструменты;Пружина
Пряные травы микс d-15 см;продукты;Пряные
Пуансетия d-12 см с топпером на День учителя в подарочной упаковке;садоводство;Пуансетия
Пуансеттия d-12 см белая;садоводство;Пуансеттия
Пуансеттия d-12 см красная;садоводство;Пуансеттия
Пуансеттия d-12 см красная с розовым;садоводство;Пуансеттия
Пуансеттия d-15 см красная;садоводство;Пуансеттия
Пуансеттия d-15 см розовая;садоводство;Пуансеттия
Пуансеттия d-23 см белая;садоводство;Пуансеттия
Пуансеттия d-23 см красная;садоводство;Пуансеттия
Пуансеттия в горшке D12 см белая с красным;садоводство;Пуансеттия
Пуансеттия в горшке D23 см розовая;садоводство;Пуансеттия
Пылесос DELTA DL-0831 красный 1300 Вт мешок для сбора пыли 1 в подарок мощность всасывания 200 Вт;электроника;Пылесос
Пылесос DELTA DL-0835 синий 1600 Вт мешок для сбора пыли 1 в подарок мощность всасывания 300 Вт;электроника;Пылесос
Пьезозажигалка с мультиискрой на батарейке ТД1-005В;кухонные принадлежности;Пьезозажигалка
Радермахера d-12 см h-20 см;садоводство;Радермахера
Разделочная доска Attribute GRANITE 20х30 см ABX111;кухонные принадлежности;Разделочная
Разделочная доска WEBBER РД-00055 из бамбука 33х24х1 см;кухонные принадлежности;Разделочная
Разделочная доска Классика О-35 35х21х1,5 см;кухонные принадлежности;Разделочная
Ранункулус Клуни Ханои 45 см Нидерланды 10 штук в упаковке;садоводство;Ранункулус
Рассада Арбуза сорт Астраханский, горшок 9*9см;садоводство;Рассада
Рассада Арбуза сорт Огонек горшок 9х9 см P-9;садоводство;Рассада
Рассада Арбуза сорт Продюсер, горшок 9*9см;садоводство;Рассада
Рассада Арбуза сорт Сибирские огни, горшок 9*9см;садоводство;Рассада
Рассада Арбуза сорт Шуга Бэби горшок 9х9 см P-9;садоводство;Рассада
Рассада в кассете Огурец Атос 10 шт;садоводство;Рассада
Рассада Дыни сорт Алтайская, горшок 9*9см;садоводство;Рассада
Рассада Дыни сорт Дина горшок 9х9 см P-9;садоводство;Рассада
Рассада Дыни сорт Казачка, горшок 9*9см;садоводство;Рассада
Рассада Дыни сорт Колхозница горшок 9х9 см P-9;садоводство;Рассада
Рассада Дыни сорт Эфиопка горшок 9х9 см P-9;садоводство;Рассада
Рассада зелени для кухни Базилик Арарат, кассета по 6шт;садоводство;Рассада
Рассада зелени для кухни Базилик Тонус, кассета по 6шт;садоводство;Рассада
Рассада зелени для кухни Базилик Шалун, кассета по 6шт;садоводство;Рассада
Рассада зелени для кухни Душица обыкновенная Хуторянка диам. 12-13 см;садоводство;Рассада
Рассада зелени для кухни Душица обыкновенная Хуторянка диам. 9 см;садоводство;Рассада
Рассада зелени для кухни Душица-орегано розовый объем 0,5 л;садоводство;Рассада
Рассада зелени для кухни Душицы в горшке диам. 9 см;садоводство;Рассада
Рассада зелени для кухни Зверобой продырявленный Оптимист диам. 9 см;садоводство;Рассада
Рассада зелени для кухни Иссоп лекарственный Аккорд диам. 12-13 см;садоводство;Рассада
Рассада зелени для кухни Иссоп лекарственный Аккорд диам. 9 см;садоводство;Рассада
Рассада зелени для кухни Кориандр в кассете 6 шт;садоводство;Рассада
Рассада зелени для кухни Лаванда Блю Райдер диам. 9 см;садоводство;Рассада
Рассада зелени для кухни Лаванда Прованc диам. 9 см;садоводство;Рассада
Рассада зелени для кухни Лаванда Эдельвейс диам. 9 см;садоводство;Рассада
Рассада зелени для кухни Лаванды в горшке диам. 9 см;садоводство;Рассада
Рассада зелени для кухни Лаванды в кассете по 6 шт;садоводство;Рассада
Рассада зелени для кухни Мангольд в кассете 6 шт;садоводство;Рассада
Рассада зелени для кухни Мелисса лекарственная Кадриль диам. 9 см;садоводство;Рассада
Рассада зелени для кухни Мелисса лимонная зеленый объем 0,75 л;садоводство;Рассада
Рассада зелени для кухни Мелиссы в горшке диам. 9 см;садоводство;Рассада
Рассада зелени для кухни Мелиссы в кассете по 6 шт;садоводство;Рассада
Рассада зелени для кухни Мята Бэррис энд Крим диам. 9 см;садоводство;Рассада
Рассада зелени для кухни Мята Вариегата диам. 9 см;садоводство;Рассада
Рассада зелени для кухни Мята Икс Пиперита Цитрата Грэйпфрут диам. 9 см;садоводство;Рассада
Рассада зелени для кухни Мята Икс Пиперита Цитрата Шоколад диам. 9 см;садоводство;Рассада
Рассада зелени для кухни Мята Икс Пиперита Цитрата Эа де Кологн диам. 9 см;садоводство;Рассада
Рассада зелени для кухни Мята Морокан диам. 9 см;садоводство;Рассада
Рассада зелени для кухни Мята Пиперита Строуберри диам. 9 см;садоводство;Рассада
Рассада зелени для кухни Мята Спэйниш диам. 9 см;садоводство;Рассада
Рассада зелени для кухни Мята Хиларис Свит Лемон диам. 9 см;садоводство;Рассада
Рассада зелени для кухни Мята Эппл Минт диам. 9 см;садоводство;Рассада
Рассада зелени для кухни Мяты в горшке диам. 9 см;садоводство;Рассада
Рассада зелени для кухни Мяты в кассете по 6 шт;садоводство;Рассада
Рассада зелени для кухни Ориганум Ауреум Голд диам. 9 см;садоводство;Рассада
Рассада зелени для кухни Ориганум Ауреум Компактум диам. 9 см;садоводство;Рассада
Рассада зелени для кухни Пастернак в кассете 6 шт;садоводство;Рассада
Рассада зелени для кухни Петрушка корневая Сахарная, кассета по 6шт;садоводство;Рассада
Рассада зелени для кухни Петрушка Кучерявец, кассета по 6шт;садоводство;Рассада
Рассада зелени для кухни Петрушка Универсал, кассета по 6шт;садоводство;Рассада
Рассада зелени для кухни Розмарин Барбекю диам. 9 см;садоводство;Рассада
Рассада зелени для кухни Розмарин Блю Лагун диам. 9 см;садоводство;Рассада
Рассада зелени для кухни Розмарин Найфа диам. 9 см;садоводство;Рассада
Рассада зелени для кухни Розмарин Оффициналис Мисс Джесоп диам. 9 см;садоводство;Рассада
Рассада зелени для кухни Розмарин Оффициналис Тускан Блю диам. 9 см;садоводство;Рассада
Рассада зелени для кухни Розмарина в горшке диам. 9 см;садоводство;Рассада
Рассада зелени для кухни Розмарина в кассете по 6 шт;садоводство;Рассада
Рассада зелени для кухни Сальвия Максима диам. 12-13 см;садоводство;Рассада
Рассада зелени для кухни Сальвия Максима диам. 9 см;садоводство;Рассада
Рассада зелени для кухни Сальвия Оффициналис Иктерина диам. 9 см;садоводство;Рассада
Рассада зелени для кухни Сальвия Оффициналис Триколор диам. 12-13 см;садоводство;Рассада
Рассада зелени для кухни Сальвия Оффициналис Триколор диам. 9 см;садоводство;Рассада
Рассада зелени для кухни Сантолина Хамаекипарисус диам. 9 см;садоводство;Рассада
Рассада зелени для кухни Сельдерей корневой Силач, кассета по 10шт;садоводство;Рассада
Рассада зелени для кухни Сельдерей листовой Бодрость, кассета по 10шт;садоводство;Рассада
Рассада зелени для кухни Тимьян Вариегэйтид диам. 9 см;садоводство;Рассада
Рассада зелени для кухни Тимьян Вульгарис Компактус диам. 9 см;садоводство;Рассада
Рассада зелени для кухни Тимьян Дюн Валей диам. 9 см;садоводство;Рассада
Рассада зелени для кухни Тимьян Прострэйт диам. 9 см;садоводство;Рассада
Рассада зелени для кухни Тимьян Сильвер Квин диам. 9 см;садоводство;Рассада
Рассада зелени для кухни Тимьян Сильвер Кинг диам. 9 см;садоводство;Рассада
Рассада зелени для кухни Тимьян Цитриодорус диам. 9 см;садоводство;Рассада
Рассада зелени для кухни Тимьяна в горшке диам. 9 см;садоводство;Рассада
