product;section;key2
Таз пластмассовый строительный круглый 65 л, 1404076;ванна;Таз
Таз пластмассовый строительный прямоугольный 60 л, 1404075;ванна;Таз
Таз пластмассовый строительный прямоугольный 80 л, 1404085;ванна;Таз
Тарелка десертная Attribute LILY TRACERY WHITE 20 см ADL021;посуда;Тарелка
Тарелка десертная Attribute ROSETTE 19 см ADR131;посуда;Тарелка
Тарелка десертная Luminarc ДИВАЛИ 19 см D7358;посуда;Тарелка
Тарелка десертная Luminarc СИНА СИЛЬВЕР 19 см L0886;посуда;Тарелка
Тарелка десертная БАМБУК 20 см J0276 Luminarc;посуда;Тарелка
Тарелка десертная ВОЛАРЭ БЛЭК 22,5 см G9399 Luminarc;посуда;Тарелка
Тарелка десертная ИРИС D3700 Luminarc;посуда;Тарелка
Тарелка десертная КОТОН ФЛАУЭР 19,5 см H2783 Luminarc;посуда;Тарелка
Тарелка десертная КУТЮР 20,5 см J2402 Luminarc;посуда;Тарелка
Тарелка десертная МАГДА 19 см H8579 Luminarc;посуда;Тарелка
Тарелка десертная МОКА БРАУН 19 см H7013 Luminarc;посуда;Тарелка
Тарелка десертная СТОУНМАНИЯ ОРАНЖ 20,5 см H3557 Luminarc;посуда;Тарелка
Тарелка десертная ХЕЛЛО КИТТИ СВИТ ПИНК 20 см H5479 Luminarc;посуда;Тарелка
Тарелка обеденная Luminarc АМОРИ БРАУН 26 см J1754;посуда;Тарелка
Тарелка обеденная Luminarc ГРИН ФОРЕСТ 26 см H7239;посуда;Тарелка
Тарелка обеденная Luminarc ОКЕАН ЭКЛИПС 24 см L5078;посуда;Тарелка
Тарелка обеденная Luminarc ПУЭБЛО корал 69883;посуда;Тарелка
Тарелка обеденная АЛЬТО САПФИР 26 см J1749 Luminarc;посуда;Тарелка
Тарелка обеденная ГРИН ОД 25 см G0707 Luminarc;посуда;Тарелка
Тарелка обеденная КАШИМА ПУРПЛ 25 см G9324 Luminarc;посуда;Тарелка
Тарелка обеденная КОТОН ФЛАУЭР 25 см H2776 Luminarc;посуда;Тарелка
Тарелка обеденная ЛИМОН ФИЦ 25см, G9547, Luminarc, Франция;посуда;Тарелка
Тарелка обеденная МУНЛАЙТ 25 см H7253 Luminarc;посуда;Тарелка
Тарелка обеденная СТЕЛЛА ШОКОЛАД 25 см J1762 Luminarc;посуда;Тарелка
Тарелка обеденная СТОУНМАНИЯ ОРАНЖ 25 см H3556 Luminarc;посуда;Тарелка
Тарелка суповая Luminarc МАРИСА ОРАНЖ 20 см J7687;посуда;Тарелка
Тарелка суповая Luminarc ОКЕАН ЭКЛИПС 20,5 см L5079;посуда;Тарелка
Тарелка суповая ВОЛАРЭ БЛЭК 23 см G9402 Luminarc;посуда;Тарелка
Тарелка суповая ИРИС 21 см J1299 Luminarc;посуда;Тарелка
Тарелка суповая КУТЮР 22,5 см J2397 Luminarc;посуда;Тарелка
Тарелка суповая МОКА БРАУН 22,5 см H7012 Luminarc;посуда;Тарелка
Тарелка суповая СТОУНМАНИЯ КАПУЧИНО 20 см J2132 Luminarc;посуда;Тарелка
Тарелка суповая СТОУНМАНИЯ ОРАНЖ 20 см H3558 Luminarc;посуда;Тарелка
Тележка багажная DELTA DT-22 коричневый грузоподъемность 20 кг сумка и 50 кг каркас РОССИЯ;сумки;Тележка
Тележка багажная DELTA DT-22 синий грузоподъемность 20 кг сумка и 50 кг каркас РОССИЯ;сумки;Тележка
Тележка багажная DELTA DT-23 грузоподъемность 50 кг РОССИЯ;сумки;Тележка
Тележка багажная DELTA ТБР-15 цвет в ассортименте грузоподъемность 30 кг РОССИЯ;сумки;Тележка
Тележка багажная DELTA ТБР-20 коричневый с оранжевым грузоподъемность 25 кг сумка и 50 кг каркас РОССИЯ;сумки;Тележка
Тележка багажная DELTA ТБР-20 синий грузоподъемность 25 кг сумка и 50 кг каркас РОССИЯ;сумки;Тележка
Тележка багажная DELTA ТБР-20 черный с серым грузоподъемность 25 кг сумка 50 кг каркас РОССИЯ;сумки;Тележка
Тележка багажная DELTA ТБР-21 черный грузоподъемность 25 кг для сумка и 50 кг для каркас РОССИЯ;сумки;Тележка
Тележка багажная DELTA ТБР-22 коричневый грузоподъемность 20 кг сумка и 50 кг каркас РОССИЯ;сумки;Тележка
Тележка багажная DELTA ТБР-22 синий грузоподъемность 20 кг сумка и 50 кг каркас РОССИЯ;сумки;Тележка
Тележка багажная DELTA ТБР-23 грузоподъемность 50 кг РОССИЯ;сумки;Тележка
Тележка багажная ручная 25 кг (сумка), 50 кг (каркас) ТБР-20 синяя с красной клеткой;сумки;Тележка
Тележка хозяйственная 2-колесная большая с кральями тип-5, 1209055;сумки;Тележка
Тележка хозяйственная 4-колесная большая тип-7, 1209057;сумки;Тележка
Тележка хозяйственная Gimi Atos;сумки;Тележка
Тележка хозяйственная багажная D-T101 грузоподъемность 25кг;сумки;Тележка
Тележка хозяйственная РОЛЛА с крыльями, Attribute, ATT101;сумки;Тележка
Тележка хозяйственная складная, ТХ0252, 30 кг, Пэмби;сумки;Тележка
Тележка хозяйственная складная, ТХ0253, 50 кг, Пэмби;сумки;Тележка
Терка WEBBER из нержавеющей стали ВЕ-048 4 грани 20 см с красной ручкой;кухонные принадлежности;Терка
Терка WEBBER из нержавеющей стали ВЕ-054 6 граней 21 см;кухонные принадлежности;Терка
Терка для сыра Comfortline из нержавеющей стали и пластика белая, Leifheit, 03148;кухонные принадлежности;Терка
Термокружка Alpenkok AK-04009A красный 400 мл;посуда;Термокружка
Термокружка Alpenkok AK-04010A синий 400 мл;посуда;Термокружка
Термокружка вакуумная Alpenkok из нержавеющей стали AK-04002A коричневая 400 мл;посуда;Термокружка
Термокружка Забава РК-0402М ВИШНЯ 400 мл;посуда;Термокружка
Термокружка Яромир КРЕМЛЬ ЯР-2406М 400 мл;посуда;Термокружка
Термометр на окно уличный на липучках Т-5 h-20 см 1210035;кухонные принадлежности;Термометр
Термометр уличный оконный ТБ 202 h-20 см 1210036;кухонные принадлежности;Термометр
Термос 1л SVB-1000H;кухонные принадлежности;Термос
Термос со стеклянной колбой 0,8л 21008;кухонные принадлежности;Термос
Термос со стеклянной колбой 1,0 л серо-зеленый 31004/13S;кухонные принадлежности;Термос
Термос со стеклянной колбой 1,0 л темно-зеленый 31003/12S;кухонные принадлежности;Термос
Термос со стеклянной колбой 1,2 л 21013;кухонные принадлежности;Термос
Термостакан WEBBER BE-6030 КОФЕ 450 мл;посуда;Термостакан
Термостакан WEBBER ВЕ-6031 ЧАЙ 450 мл;посуда;Термостакан
Тимьян d-9 см;садоводство;Тимьян
Тимьян в горшке d-15 см;садоводство;Тимьян
Тимьян крымский d-7 см;садоводство;Тимьян
Тимьян овощной Медок 0,1 г 4660010776423;садоводство;Тимьян
Ткань для гигиенических поверхностей (для чистки и впитывания с антибактериальным покрытием) 400*400 мм, Leifheit, 40000;текстиль;Ткань
Ткань для окон Duo для влажной и сухой чистки 200*200 мм, Leifheit, 40002;текстиль;Ткань
Ткань универсальная из микрофибры Micro Magic серая, Leifheit, 40020;текстиль;Ткань
Толкушка деревянная ( Бук ) 1530018;текстиль;Толкушка
Толкушка для картофеля из нержавеющей стали Proline, Leifheit, 03032;текстиль;Толкушка
Томат Балконное чудо 0,1 г 4660010772531;садоводство;Томат
Томат Государь в кассете 6 штук среднеспелый детерминантный;садоводство;Томат
Томат детерминантный Грандесса в кассете 6 штук раннеспелый;садоводство;Томат
Томат детерминантный Медовый в кассете 6 штук среднеспелый;садоводство;Томат
Томат детерминантный Сердолик в кассете 6 штук раннеспелый;садоводство;Томат
"томата (помидор) ""Золотая канарейка"" №32 сорт индетерминантный среднеспелый желтый";садоводство;томата
томата (помидор) Абрикос №1 сорт индетерминантный среднеспелый красный;садоводство;томата
томата (помидор) Абрикосовый брендивайн №2 сорт индетерминантный среднеспелый оранжевый;садоводство;томата
томата (помидор) Абруццо № 3 сорт индетерминантный среднеспелый красный;садоводство;томата
томата (помидор) Амурский тигр № 8 сорт детерминантный раннеспелый красный;садоводство;томата
томата (помидор) Арбузик №4 сорт индетерминантный раннеспелый красный;садоводство;томата
томата (помидор) Арбузный №5 сорт индетерминантный среднеспелый красный;садоводство;томата
томата (помидор) Аргентинская сливка №6 сорт индетерминантный среднеспелый красный;садоводство;томата
томата (помидор) Бандед Амазон № 20 сорт индетерминантный раннеспелый розовый;садоводство;томата
томата (помидор) Баскью Блю №7 сорт детерминантный среднеспелый синий;садоводство;томата
томата (помидор) Болгарска хала №9 сорт индетерминантный среднеспелый розовый;садоводство;томата
томата (помидор) Большая желтая зебра №10 сорт индетерминантный среднеспелый желтый;садоводство;томата
томата (помидор) Большой оранжевый №11 сорт индетерминантный среднеспелый оранжевый;садоводство;томата
томата (помидор) Большой оранжевый полосатый № 28 сорт индетерминантный среднеспелый оранжевый;садоводство;томата
томата (помидор) Большой полосатый кабан №12 сорт индетерминантный среднеспелый красный;садоводство;томата
томата (помидор) Вернисаж черный №17 сорт индетерминантный раннеспелый черный;садоводство;томата
томата (помидор) Гигант Кубы №18 сорт индетерминантный среднеспелый черный;садоводство;томата
томата (помидор) Голубика №22 сорт индетерминантный среднеспелый синий;садоводство;томата
томата (помидор) Голубой ручей №23 сорт индетерминантный среднеспелый синий;садоводство;томата
томата (помидор) Графити № 40 сорт индетерминантный раннеспелый красный;садоводство;томата
томата (помидор) Грейпфрут № 43 сорт индетерминантный среднеспелый оранжевый;садоводство;томата
томата (помидор) Джалпа №25 сорт детерминантный среднеспелый красный;садоводство;томата
томата (помидор) Дрова №27 сорт детерминантный среднеспелый красный;садоводство;томата
томата (помидор) Земляника оранжевая №31 сорт индетерминантный среднеспелый оранжевый;садоводство;томата
томата (помидор) Ильди №35 сорт детерминантный раннеспелый желтый;садоводство;томата
томата (помидор) Индиго Роуз №36 сорт детерминантный среднеспелый синий;садоводство;томата
томата (помидор) Исуповский №37 сорт индетерминантный среднеспелый красный;садоводство;томата
томата (помидор) К 25-56 № 78 сорт детерминантный среднеспелый черный;садоводство;томата
томата (помидор) Казацкий №38 сорт детерминантный среднеспелый красный;садоводство;томата
томата (помидор) Канестрино №1 №89 сорт индетерминантный среднеспелый красный;садоводство;томата
томата (помидор) Кибиц №41 сорт детерминантный среднеспелый красный;садоводство;томата
томата (помидор) Колоновидный № 90 сорт детерминантный среднеспелый красный;садоводство;томата
томата (помидор) Король красоты №46 сорт индетерминантный среднеспелый оранжевый;садоводство;томата
томата (помидор) Красный пушистый кабан №47 сорт детерминантный среднеспелый красный;садоводство;томата
томата (помидор) Кумато №49 сорт детерминантный среднеспелый черный;садоводство;томата
томата (помидор) Легенда Тарасенко № 91 сорт индетерминантный среднеспелый красный;садоводство;томата
томата (помидор) Летнее солнце № 92 сорт индетерминантный раннеспелый желтый;садоводство;томата
томата (помидор) Медовая капля №51 сорт индетерминантный среднеспелый желтый;садоводство;томата
томата (помидор) Медовый № 93 сорт индетерминантный позднеспелый розовый;садоводство;томата
томата (помидор) Минусинские № 94 сорт индетерминантный среднеспелый розовый;садоводство;томата
томата (помидор) Монгольский карлик №53 сорт детерминантный раннеспелый красный;садоводство;томата
томата (помидор) Моравское чудо №54 сорт индетерминантный раннеспелый красный;садоводство;томата
томата (помидор) Мохнатый кейт №55 сорт детерминантный среднеспелый синий;садоводство;томата
томата (помидор) Мэризол Мэджик № 95 сорт индетерминантный среднеспелый оранжевый;садоводство;томата
томата (помидор) Оранжевый банан № 60 сорт индетерминантный среднеспелый оранжевый;садоводство;томата
томата (помидор) Оранжевый русский № 97 сорт индетерминантный среднеспелый оранжевый;садоводство;томата
томата (помидор) Оранжевый с фиолетовыми пятнами № 98 сорт индетерминантный среднеспелый оранжевый;садоводство;томата
томата (помидор) Перцевидный полосатый №62 сорт детерминантный среднеспелый красный;садоводство;томата
томата (помидор) Полосатый смайлик № 100 сорт детерминантный раннеспелый красный;садоводство;томата
томата (помидор) Полосатый шоколад №65 сорт индетерминантный среднеспелый черный;садоводство;томата
томата (помидор) Поцелуй герани №66 сорт детерминантный раннеспелый красный;садоводство;томата
томата (помидор) Примари колорз №67 сорт детерминантный среднеспелый черный;садоводство;томата
томата (помидор) Пурпурная страсть № 101 сорт индетерминантный среднеспелый черный;садоводство;томата
томата (помидор) Ракета № 102 сорт детерминантный среднеспелый красный;садоводство;томата
томата (помидор) Роджеро № 104 сорт индетерминантный среднеспелый красный;садоводство;томата
томата (помидор) Розовый мохнатый кабан № 105 сорт индетерминантный среднеспелый розовый;садоводство;томата
томата (помидор) Синий солнечный свет № 106 сорт индетерминантный среднеспелый синий;садоводство;томата
томата (помидор) Синий тигр №75 сорт индетерминантный среднеспелый синий;садоводство;томата
томата (помидор) Сладкий Касади №76 сорт индетерминантный среднеспелый оранжевый;садоводство;томата
томата (помидор) сорт Бычье Сердце №14;садоводство;томата
томата (помидор) Спящая леди № 108 сорт детерминантный среднеспелый черный;садоводство;томата
томата (помидор) Танцы со смурфиками № 111 сорт индетерминантный раннеспелый черный;садоводство;томата
томата (помидор) Темная галактика №79 сорт детерминантный среднеспелый черный;садоводство;томата
томата (помидор) Улыбка Розы № 113 сорт детерминантный раннеспелый синий;садоводство;томата
томата (помидор) Фейерверк № 114 сорт индетерминантный среднеспелый красный;садоводство;томата
томата (помидор) Черниченский черри № 116 сорт индетерминантный позднеспелый черный;садоводство;томата
томата (помидор) Шаймет криг №117 сорт детерминантный раннеспелый красный;садоводство;томата
томата (помидор) Шалун № 118 сорт индетерминантный раннеспелый розовый;садоводство;томата
томата (помидор) Шахерезада №84 сорт детерминантный среднеспелый красный;садоводство;томата
томата (помидор) Ширли сердцевидный № 119 сорт индетерминантный среднеспелый розовый;садоводство;томата
томата (помидор) Этуаль №85 сорт детерминантный среднеспелый розовый;садоводство;томата
томата (помидор) Южный вечер № 120 сорт детерминантный среднеспелый черный;садоводство;томата
томата (помидор) Юсуповский Узбекский №86 сорт индетерминантный позднеспелый красный;садоводство;томата
Тортница CURVER 00416-286-00;посуда;Тортница
Тряпка для кафеля и паркета микрофибра макси 40х50 см ВИТНЕТТ, Rozenbal, R212766;хозяйственно-бытовые принадлежности;Тряпка
Тряпкодержатель с металлическим креплением (Г) 1804015;хозяйственно-бытовые принадлежности;Тряпкодержатель
Тыква крупноплодная Лечебная d-7 см раннеспелый;садоводство;Тыква
Тюльпан Louvre (Лувр) Бахромчатый 25 шт;садоводство;Тюльпан
Увлажняющая маска Brown Rice Moisture 330 мл Корея 599928;косметика и гигиена;Увлажняющая
Уголок оконный 100х100 мм медь антик с полимерным покрытием *Тонар*, 1109038;инструменты;Уголок
Укроп Обильнолистный 3,0 г 4660010772562;садоводство;Укроп
Универсальное средство на основе хлора ддля чистки сантехники и других поверхностей DECS Universal 750 мл Россия 4660015923228;бытовая химия;Универсальное
Универсальный нож WEBBER из нержавеющей стали Русские мотивы 12,7 см с деревянной ручкой ВЕ-2252D;посуда;Универсальный
"Урна уличная ""Гео"", Hobbyka/Хоббика, 59*37,5см, сталь";садоводство;Урна
Урна уличная стальная Сальвадор 02.021.0 46х110 см;садоводство;Урна
Урна уличная стальная Юпитер 02.012.0 38х38х60 см;садоводство;Урна
Урна-пепельница из нержавеющей стали, Hobbyka/Хоббика, 83*38см, ПА022;хозяйственно-бытовые принадлежности;Урна-пепельница
