product;section;key2
Коврик придверный полиэстер, 46х76 см, Drifted Nature, Изменчивость, Mohawk, 5007;ковры;Коврик
Коврик придверный пористый из полимерных материалов 60х90 см коричневый, Vortex, D022;ковры;Коврик
Коврик придверный с дизайном, из резины и кокоса 58,5*89 Gothic Iron Slice / Готический Узор, 4468;ковры;Коврик
Коврик придверный с дизайном, из резины и кокоса Aberdeen Welcome 45x76, 4395;ковры;Коврик
Коврик придверный хлопковый 120х180 см мультиколор, Helex, С07;ковры;Коврик
Коврик придверный хлопковый 55х110 см мультиколор, Helex, С03;ковры;Коврик
Коврик придверный хлопковый 60х140 см мультиколор, Helex, С04;ковры;Коврик
Коврик придверный хлопковый 60х180 см мультиколор, Helex, С05;ковры;Коврик
Коврик придверный хлопковый 60х250 см мультиколор, Helex, С06;ковры;Коврик
Коврик придверный, полипропилен, 40х70 см, Kokarda, Пес и кот, бежевый, PHP SRL, 21417;ковры;Коврик
Коврик придверный, полипропилен, 40х70 см, Kokarda, Спящий кот, бежевый, PHP SRL, 20734;ковры;Коврик
Коврик придверный, полукруглый из резины и кокоса, 40х68 см, Format Mezzaluna, Розетта, коричневый, PHP SRL, 20657;ковры;Коврик
Коврик противоскользящий 69х39 см овальный черепаха 5538;ковры;Коврик
Коврик противоскользящий камешки с ракушками овальный 69х39 см голубой 5520;ковры;Коврик
Коврик противоскользящий кружевной 88х38 см голубой 5527;ковры;Коврик
Коврик противоскользящий кружевной 88х38 см прозрачный 5528;ковры;Коврик
Коврик противоскользящий пузырьки 70х38 см бирюзовый 5526;ковры;Коврик
Коврик противоскользящий пузырьки 70х38 см прозрачный 5523;ковры;Коврик
Коврик резиновый ажурный Iron Grill 45х75 см 6207;ковры;Коврик
Коврик хлопковый 40х60 см цвета в ассортименте 6194;ковры;Коврик
Коврик хлопковый 45х75 см цвета в ассортименте 6195;ковры;Коврик
Коврик хлопковый 50х80 см цвета в ассортименте 6196;ковры;Коврик
Ковш пластмассовый ИЖ, 2 л 1406003;посуда;Ковш
Ковш пластмассовый Полимербыт С215, 1,5 л 1406006;посуда;Ковш
Кодонанта укорененный черенок 1 шт;садоводство;Кодонанта
Колеус рассада однолетних цветов в кассете по 10 шт;садоводство;Колеус
Колеус рассада однолетних цветов в кассете по 6 шт;садоводство;Колеус
Колокольчик Карпатский белый объем 0,5 л;садоводство;Колокольчик
Колокольчик Карпатский голубой объем 0,5 л;садоводство;Колокольчик
Колокольчик персиколистный белый объем 0,5 л;садоводство;Колокольчик
Кольца для штор Виолет 12 шт пластик 1212/60;предметы интерьера;Кольца
Комнатное растение в горшке Алое Вера, d12, h30;садоводство;Комнатное
Комнатное растение в горшке Аспарагус Мейера, d12, h30;садоводство;Комнатное
Комнатное растение в горшке Кофе Арабика, d12, h25;садоводство;Комнатное
Комнатное растение в горшке Плектрантус подвесной горшок, d16, h30;садоводство;Комнатное
Комнатное растение в горшке Плющ, хедера салатовая листва подвесной горшок, d16, h30;садоводство;Комнатное
Комнатное растение в горшке Сциндапсус зеленый подвесной горшок, d15-16, h30;садоводство;Комнатное
Комнатное растение в горшке Традесканция красная с белым подвесной горшок , d16, h30;садоводство;Комнатное
Комнатное растение Пуансеттия D10;садоводство;Комнатное
Комод Эльфпласт № 3 Алфавит оранжевый 301о;мебель;Комод
Комод Эльфпласт Виола 3-х секционный коричневый 339;мебель;Комод
Комплект для ванной и туалета Dasch 50х80 см и 55х55 см TL-2-E Лавр бежевый 5755;ванна;Комплект
Комплект для мытья полов из нержавеющей стали и пластика Clean Twist Mop зеленый: швабра-моп + ведро 20 л с механизмом отжима, L;бытовая химия;Комплект
Комплект махровых полотенец 60х30 см WELLNESS ПРОМО_3 100% хлопок;текстиль;Комплект
Комплект махровых салфеток ТОП_2, 100% хлопок 266 г/м2, 28х42 см, 2 шт, цвета в ассортименте, Wellness, 4630005364393;текстиль;Комплект
Комплект постельного белья WELLNESS PLATINUM R185-Авеню пододеяльник 180х214 см простыня 200х214 см 2 наволочки 50х70 см;текстиль;Комплект
Кондиционер для белья Sandokkaebi Soft Aroma Aqua Blue Свежесть океана флакон 2100 мл Корея 8801353-003494;бытовая химия;Кондиционер
Контейнер герметичный прямоугольный Виолет 092/051 500 мл дымчатый;хранение и порядок;Контейнер
Контейнер для мусора FLIP BIN CURVER 25 л графитовый 02171-686-00;хранение и порядок;Контейнер
Контейнер для мусора FLIP BIN CURVER 25 л красный 02171-547-00;хранение и порядок;Контейнер
Контейнер для мусора FLIP BIN CURVER 25 л оранжевый 02171-535-00;хранение и порядок;Контейнер
Контейнер для мусора ДОМИНИК CURVER 25 л серебристый 05322-877;хранение и порядок;Контейнер
Контейнер для мусора пластиковый 50 л 40,7х30,6х72,7 см РОЛЛ ТОП серый, Curver, D 03977-856;хранение и порядок;Контейнер
Контейнер для овощей Полимербыт 3-х секционный лоток 9 л 4312600;хранение и порядок;Контейнер
Контейнер для приготовления 2-х яиц ГЛАЗУНЬЯ Полимербыт C452;хранение и порядок;Контейнер
Контейнер для продуктов PASABAHCE 1,25 л голубой OTS161560-005;хранение и порядок;Контейнер
Контейнер для СВЧ Полимербыт Премиум 0,5 л 4356000;хранение и порядок;Контейнер
Контейнер для СВЧ Полимербыт Премиум 1,2 л 4356200;хранение и порядок;Контейнер
Контейнер для СВЧ ПЦ2211ЛМ с паровыпускным клапаном 0,5 л лайм;хранение и порядок;Контейнер
Концентрат для мытья посуды Mama Ultimate Зеленый чай 1000 мл РоссияКорея 049320;бытовая химия;Концентрат
Кореопсис Золотой маяк желтый объем 1 л;садоводство;Кореопсис
Кореопсис Толл 0,1 г 4650091480258;садоводство;Кореопсис
Корзина CITY NEW YORK 35х30х33 см Curver 00274-T37;хранение и порядок;Корзина
Корзина для белья INFINITY CURVER 59 л белая 04754-N23-00;хранение и порядок;Корзина
Корзина для белья KNIT 57 л темно-коричневая, Curver, 03676-X59-00;хранение и порядок;Корзина
Корзина для белья KNIT CURVER 57 л белая 03676-X64-00;хранение и порядок;Корзина
Корзина для белья KNIT CURVER 57 л фиолетовая 03676-X66-00;хранение и порядок;Корзина
Корзина для белья бамбук угловая 37х58см, Attribute, ASB386;хранение и порядок;Корзина
Корзина для белья ВИОЛЕТ Вязь 60 л с крышкой лиловая 2060/21;хранение и порядок;Корзина
Корзина для белья Виолет Ротанг 2350/2 угловая с крышкой 60 л бежевая;хранение и порядок;Корзина
Корзина для белья ВИОЛЕТ с крышкой Ротанг 40 л капучино 1840/19;хранение и порядок;Корзина
Корзина для белья ВИОЛЕТ с крышкой Ротанг 40 л латте 1840/20;хранение и порядок;Корзина
Корзина для белья ВИОЛЕТ с крышкой Ротанг 60 л белая 1860/06;хранение и порядок;Корзина
Корзина для белья ВИОЛЕТ угловая с крышкой Ротанг 60 л белая 2350/6;хранение и порядок;Корзина
Корзина для белья пластмассовая 45 л угловая С299 1704006;хранение и порядок;Корзина
Корзина для белья ЭЛЬФПЛАСТ Paola 30 л бежевая 427беж;хранение и порядок;Корзина
Корзина для белья ЭЛЬФПЛАСТ Paola 55 л бежевая 426беж;хранение и порядок;Корзина
Корзина для белья ЭЛЬФПЛАСТ Виола 30 л бежевая 204;хранение и порядок;Корзина
Корзина для белья ЭЛЬФПЛАСТ Виола 30 л коричневая 204к;хранение и порядок;Корзина
Корзина для глаженного белья NATURAL STYLE пластиковая темно-серая 45 л 38х59,2х27 см, Curver, D 00708-308;хранение и порядок;Корзина
Корзина для глаженного белья Natural Style, 45 л, 27*38*59 см, коричневая, D 00708-213, Curver 00708-213;хранение и порядок;Корзина
Корзина мягкая пластиковая 17 л, М-пластика, M2880;хранение и порядок;Корзина
Корзина на колесах RATTAN STYLE тёмно-коричневая Curver 01704-210;хранение и порядок;Корзина
Корзина пластиковая для белья 40л. с крышкой белая 1840/06, Виолет;хранение и порядок;Корзина
Корзина пластиковая для белья 60л. с крышкой бежевая 1860/2, Виолет;хранение и порядок;Корзина
Корзинка с крышкой Natural Style L 30 л 23,1*43,6*32,5 см кремовый D 03619-885 Curver 03619-885;хранение и порядок;Корзинка
Кориандр в кассете 6 шт;садоводство;Кориандр
Кориандр Стимул раннеспелый в кассете 4 штуки;садоводство;Кориандр
Короб стеллажный с крышкой большой, 30*40*25 см, EXPEDITION VALIANT, EX-BOX-LM;хранение и порядок;Короб
Короб стеллажный с крышкой малый, 28*30*16 см, EXPEDITION VALIANT, EX-BOX-LS;хранение и порядок;Короб
Коробка INFINITY CURVER перфорированная с крышкой 17 л белая 04742-N23-00;хранение и порядок;Коробка
Коробка для хранения бамбук 30х40х25 см Attribute ASB425;хранение и порядок;Коробка
Коробка для хранения на молнии из синтетического волокна Hausmann, 35,5х20,5х13,5 см, зеленая, BB211-3;хранение и порядок;Коробка
Коробка прямоугольная Полимербыт ПРОВАНС 5,5 л 4351107;хранение и порядок;Коробка
Корыто оцинкованное 45 л бесшовное, 1301031;ванна;Корыто
Корыто оцинкованное 45 л бесшовное, 1303007;ванна;Корыто
Космея Клюквенный клик 0,1 г 4660010770421;садоводство;Космея
Космея Кэнди страйп 0,3 г 4650091480272;садоводство;Космея
Космея Лимонад 10 шт 4650091480500;садоводство;Космея
Космея Очаровашка 0,05 г 4660010779578;садоводство;Космея
Космея Попсокс белая 10 шт 4650091480562;садоводство;Космея
Космея Попсокс розовая 10 шт 4650091480555;садоводство;Космея
Космея Снежный клик 0,1 г 4660010770414;садоводство;Космея
Котел алюминиевый 70,0 л без крышки Балезино, Хозлэнд, 1502050;хозяйственно-бытовые принадлежности;Котел
Котовник Блю Мун синий объем 1 л;садоводство;Котовник
Кофе Арабика d-7 см;продукты;Кофе
Кофе Арабика d-9 см;продукты;Кофе
Кофе Арабика в горшке d-7 см;продукты;Кофе
Кофр для хранения Hausmann подкроватный 80х40х15 см 2B-28040;хранение и порядок;Кофр
Кофр для хранения Hausmann средний 36х36х30 2 шт. 4c-202;хранение и порядок;Кофр
Кофр для хранения медикаментов Hausmann 9 отделений 30x22x12 см 4W-107;хранение и порядок;Кофр
Кофр для хранения одеял Hausmann 60х50х35 см AA003;хранение и порядок;Кофр
Кофр малый жесткий 28*30*16 см леопард Валиант / Valiant LB301;хранение и порядок;Кофр
Крассула d-17 см h-40 см;садоводство;Крассула
Крассула овата d-10 см;садоводство;Крассула
Крепеж для пружины дверной оцинкованный, 1107054;инструменты;Крепеж
Крепеж для пружины дверной, 1107055;инструменты;Крепеж
Крокусы Pickwick голубой в горшке d-21 см 19 луковиц;садоводство;Крокусы
Кружка 350 мл ROSARIO Радуга керамическая коричневый Ф13-005L;посуда;Кружка
Кружка Luminarc ДИСНЕЙ МИККИ КОЛОРС 250 мл L2127-1;посуда;Кружка
Кружка Luminarc ЛИЛИ ФЛАУЭР 320 мл J8565-1;посуда;Кружка
Кружка Luminarc ШЭЙДС БЛЭК 320 мл H8401;посуда;Кружка
Кружка БАМБУК 320 мл G0688 Luminarc Франция;посуда;Кружка
Кружка для чая Сердечки 250 мл ДСГ55029146;посуда;Кружка
Кружка для чая Ягода клубника 250 мл 1606-Д;посуда;Кружка
Кружка МАРЛИ ЭКЛИПС 250 мл H9184 Luminarc Франция;посуда;Кружка
Кружка мерная 11600 1 л;посуда;Кружка
Кружка НОРДИК 380мл прозрачная H8502 Luminarc Франция;посуда;Кружка
Кружка О МИННИ 250 мл H6441 Luminarc Франция;посуда;Кружка
Кружка прозрачная 250 мл H8437 Luminarc Франция;посуда;Кружка
Кружка с трубочкой Attribute МЯЧ 500 мл JAR501;посуда;Кружка
Кружка ТАЧКИ 250мл E9131 H1496 Luminarc Франция;посуда;Кружка
Крышка оцинкованная для стерилизации банок (на 3 банки) 1514008;посуда;Крышка
Крючок одежный 2-х рожковый серый металлик с полимерным покрытием *Тонар*, 1110027;хозяйственно-бытовые принадлежности;Крючок
Крючок одежный двойной усиленный алюминиевый (дюраль), 1110015;хозяйственно-бытовые принадлежности;Крючок
Крючок одежный тройной латунь (Б-47), 1110182;хозяйственно-бытовые принадлежности;Крючок
Крючок проволочный 120 мм оцинкованный, 1110212;хозяйственно-бытовые принадлежности;Крючок
Крючок проволочный 125 мм медь, 1110132;хозяйственно-бытовые принадлежности;Крючок
Крючок проволочный 75 мм белый, 1110137;хозяйственно-бытовые принадлежности;Крючок
Крючок проволочный 75 мм латунь, 1110136;хозяйственно-бытовые принадлежности;Крючок
Кувшин Luminarc ВИКТОРИЯ 1,8 л с крышкой J8130;садоводство;Кувшин
"Кувшин пластмассовый с крышкой ""Кумган"" 2,0 л 1408003";садоводство;Кувшин
"Кувшин пластмассовый с крышкой 2,0 л, (S-751) ""Пластхозторг"" 1408004";садоводство;Кувшин
Кухонное полотенце вафельное 64х38 см WELLNESS ЭЛИЯ-mix;текстиль;Кухонное
Кухонное полотенце махровое 42х28 см WELLNESS ФРЕШ-mix;текстиль;Кухонное
Кухонные ножницы WEBBER из нержавеющей стали с орехоколом ВЕ-5208;посуда;Кухонные
Лаванда d-9 см;садоводство;Лаванда
Лаванда в горшке d-15 см;садоводство;Лаванда
Лаванда Торх d-7 см;садоводство;Лаванда
Лаватера Монт Блан 0,3 г 4660010778588;садоводство;Лаватера
Лавр d-9 см;садоводство;Лавр
Лавр в горшке 7 см;садоводство;Лавр
Лавр нобилис d-10 см;садоводство;Лавр
Лантана d-13 см;садоводство;Лантана
Лантана в горшке d-12;садоводство;Лантана
Лапчатка Огненное пламя 0,02 г 4650091480616;садоводство;Лапчатка
Лапчатка травянистая желтый объем 0,5 л;садоводство;Лапчатка
Левкой рассада однолетних цветов в горшке диам. 12 см;садоводство;Левкой
Лен Небесная Лазурь голубой объем 0,5 л;садоводство;Лен
Лестница стремянка ЗМИ Конёк медный антик ТС 277;мебель;Лестница
Лестница-стремянка Dogrular Ufuk Al алюминевая 3-х ступенчатая;мебель;Лестница-стремянка
Лестница-стремянка Dogrular Ufuk Al алюминевая 4-х ступенчатая;мебель;Лестница-стремянка
Лестница-стремянка Dogrular Ufuk Al алюминевая 6-ти ступенчатая;мебель;Лестница-стремянка
Лестница-стремянка Dogrular Ufuk оцинкованная 3-х ступенчатая;мебель;Лестница-стремянка
Лестница-стремянка Dogrular Ufuk оцинкованная 4-х ступенчатая;мебель;Лестница-стремянка
Лестница-стремянка Dogrular Ufuk оцинкованная 7-ми ступенчатая;мебель;Лестница-стремянка
Лестница-стремянка Dogrular Ufuk оцинкованная 8-ми ступенчатая;мебель;Лестница-стремянка
Лестница-стремянка Sarayli 6-ти ступенчатая;мебель;Лестница-стремянка
Лестница-стремянка Примус оцинкованный металл 7 ступеней, 1,55 м , 1203048;мебель;Лестница-стремянка
Лилейник высокорослый смесь окрасок объем 1 л;садоводство;Лилейник
Линейка, длина 30 см, Truper, RGL-30/14387;инструменты;Линейка,
Литопс Микс d-5 см;садоводство;Литопс
Лобелия ампельная, диам. 12 см;садоводство;Лобелия
Лобелия рассада однолетних цветов в кассете по 6 шт;садоводство;Лобелия
Лобелия Регатта Regatta микс объем 0,5 л;садоводство;Лобелия
Ложка кухонная Attribute IVORY AGI030;посуда;Ложка
Ложка обувная металлическая крашенная 220, 1205155;посуда;Ложка
Ложка обувная металлическая крашенная 43 см с крючком, 1205156;посуда;Ложка
Ложка столовая RIPPLE сталь 3 мм, 3 шт, Attribute, ACR023;посуда;Ложка
Ложка чайная RIPPLE сталь 2,5 мм, 3 шт, Attribute, ACR033;посуда;Ложка
Лопатка Attribute BAMBOO AGB110;инструменты;Лопатка
Лопатка c прорезями Attribute BAMBOO AGB111;инструменты;Лопатка
Лоток KNIT A4 4,5 л CURVER белый 00778-X64-00;посуда;Лоток
Лоток для холодца эмалированный 0,8 л с пластмассовой крышкой без рисунка С-2506Кп Стэма 1506082;посуда;Лоток
Лоток для холодца эмалированный 1,5 л с пластмассовой крышкой без рисунка С-2508Кп Стэма 1506084;посуда;Лоток
Лоток для холодца эмалированный 1,5 л с пластмассовой крышкой с рисунком С-2508Кп/4 Стэма 1506085;посуда;Лоток
Лук порей Победитель в кассете 6 штук среднеспелый;садоводство;Лук
Львиный зев Волшебный ковер 0,05 г 4660010779639;садоводство;Львиный
Львиный зев рассада однолетних цветов в кассете по 10 шт;садоводство;Львиный
Львиный зев рассада однолетних цветов в кассете по 6 шт;садоводство;Львиный
Любисток Удалец в кассете 6 штук;садоводство;Любисток
Мантоварка алюминиевая 6,0 л 3 сетки Белая Калитва, Хозлэнд, 1502074;кухонные принадлежности;Мантоварка
Мантоварка-пароварка WEBBER BE-81 нержавеющая сталь d=30 см;кухонные принадлежности;Мантоварка-пароварка
Масленка КОРОВКА с крышкой 17см, 73115, Luminarc, Франция;посуда;Масленка
Маттиола Ночная фиалка 0,5 г 4660010770506;садоводство;Маттиола
Махровое полотенце 34х34 см WELLNESS EXCLUSIVE ДАККИ-31 100% хлопок;текстиль;Махровое
Махровое полотенце 50х30 см WELLNESS *АМЕЛИ_1-31 100% хлопок;текстиль;Махровое
Махровое полотенце 63,5х38 см WELLNESS СЕВИЛЬЯ_1-004 100% микрофибра;текстиль;Махровое
