product;section;key2
Tepмокружка AVEX Freeflow 700 мл зеленый AVEX0759;посуда;Tepмокружка
Tepмокружка AVEX Freeflow 700 мл сталь AVEX0776;посуда;Tepмокружка
Tepмокружка AVEX Recharge 500 мл голубой AVEX0681;посуда;Tepмокружка
Автоматическая щетка Leifheit для мытья окон с ручкой 43 см. 51114;хозяйственно-бытовые принадлежности;Автоматическая
Агератум рассада однолетних цветов в кассете по 10 шт;садоводство;Агератум
Адиантум Лиза d-12 см;садоводство;Адиантум
Азалия индика Биколор d-12 см;садоводство;Азалия
Азалия Индика Биколор d-12 см h-20;садоводство;Азалия
Азалия Индика розовая d-12 см h-20;садоводство;Азалия
Азалия Индика фиолетовая d-10 см h-20;садоводство;Азалия
Аквилегия махровая Тауэр смесь окрасок объем 1 л;садоводство;Аквилегия
Аквилегия обыкновенная Барлоу микс объем 1 л;садоводство;Аквилегия
Алиссум (лобулярия) Снежные одежды 0,2 г 4650091480302;садоводство;Алиссум
Алиссум рассада однолетних цветов в кассете по 10 шт;садоводство;Алиссум
Алиссум рассада однолетних цветов в кассете по 6 шт;садоводство;Алиссум
Алиссум Скальный желтый объем 1 л;садоводство;Алиссум
Алоэ Вера d-12 см h-25 см;садоводство;Алоэ
Альбука Спиралис Фризл-Сизл d-12 см;садоводство;Альбука
Амариллис Red Lion темно-красный в горшке d-12 см 1 луковица;садоводство;Амариллис
Анемона белый объем 0,5 л;садоводство;Анемона
Антижир POSH ONE MAGNUM 828 мл Россия 4580390-927058;бытовая химия;Антижир
Антинакипин для утюгов Ампулы 10 мл по 5 шт UN MOMENTO Россия 4627096350107;бытовая химия;Антинакипин
Антуриум андрианум Блэк d-12 см;садоводство;Антуриум
Антуриум андрианум Ванилла d-12 см;садоводство;Антуриум
Антуриум андрианум Многоцветковый Красный d-12 см;садоводство;Антуриум
Антуриум андрианум Пикассо голубой d-15 см;садоводство;Антуриум
Антуриум Андрианум розовый d-12 см;садоводство;Антуриум
Антуриум андрианум Фиорино d-15 см;садоводство;Антуриум
Антуриум Тропик Найт НИДЕРЛАНДЫ 1 штука в упаковке;садоводство;Антуриум
Аптения d-10 см h-10 см;садоводство;Аптения
Аптения d-12 см h-15 см;садоводство;Аптения
Арбуз Волгоградец Р-9;садоводство;Арбуз
Арбуз Огонек раннеспелый d-7 см;садоводство;Арбуз
Арбуз Сибирские огни раннеспелый d-7 см;садоводство;Арбуз
Арбуз Холодок позднеспелая d-7 см;садоводство;Арбуз
Арбуз Шуга Бейби раннеспелый d-7 см;садоводство;Арбуз
Аргирантерум рассада однолетних цветов в горшке диам. 12 см;садоводство;Аргирантерум
Ароматизированное средство дудаления известкового налета и ржавчины DECS WC Гель Лимон 750 мл Россия 4660015923235;ванна;Ароматизированное
Артемизия (Полынь горькая) d-9 см;садоводство;Артемизия
Аспарагус d-12 см h-30 см;садоводство;Аспарагус
Аспарагус Спренжери d-12 см;садоводство;Аспарагус
Астра альпийская микс объем 1 л;садоводство;Астра
Астра рассада однолетних цветов в кассете по 10 шт;садоводство;Астра
Астра рассада однолетних цветов в кассете по 6 шт;садоводство;Астра
Афеляндра скуарроса Дания d-12 см;садоводство;Афеляндра
Афеляндра скуарроса Дания Микс в кашпо с автополивом;садоводство;Афеляндра
Бадан Сердцелистный Красная звезда красный объем 1 л;садоводство;Бадан
Базилик Застольный 0,3 г 4660010775419;садоводство;Базилик
Базилик зеленый Тонус d-7 см;садоводство;Базилик
Базилик Овощной Арарат d-7 см;садоводство;Базилик
Базилик овощной Арарат в кассете 4 штуки среднеспелый;садоводство;Базилик
Базилик овощной Пурпурные звезды в кассете 4 штуки среднеспелый;садоводство;Базилик
Базилик овощной Тонус в кассете 4 штуки среднеспелый;садоводство;Базилик
Базилик Пурпурные Звезды d-7 см;садоводство;Базилик
Базилик Смесь зеленого и фиолетового 0,4 г 4660010775433;садоводство;Базилик
Бак для белья Hailo 0744-221, 44 л, стальной;хранение и порядок;Бак
Баклажан Самурай d-7 см Крым;садоводство;Баклажан
Бакопа ампельная махровая белая махровая объем 0,5 л;садоводство;Бакопа
Бакопа ампельная махровая сиреневая махровая объем 0,5 л;садоводство;Бакопа
Бакопа ампельная махровая фиолетовая махровая объем 0,5 л;садоводство;Бакопа
Бакопа ампельная мега-крупная белая объем 0,5 л;садоводство;Бакопа
Бакопа ампельная мега-крупная розовая объем 0,5 л;садоводство;Бакопа
Бакопа ампельная мега-крупная синяя объем 0,5 л;садоводство;Бакопа
Бакопа ампельная мега-крупная сиреневая объем 0,5 л;садоводство;Бакопа
Бакопа ампельная, диам. 12 см;садоводство;Бакопа
Бальзам для мытья посуды Mama Ultimate EcoSoda 1000 мл Россия 044684;бытовая химия;Бальзам
Бальзамин Валера рассада однолетних цветов в кассете по 10 шт;садоводство;Бальзамин
Бальзамин новогвинейский d-13 см;садоводство;Бальзамин
Бальзамин новогвинейский d-13 см белый;садоводство;Бальзамин
Бальзамин новогвинейский d-13 см белый с розовым цвет фуксии с белыми вкраплениями;садоводство;Бальзамин
Бальзамин новогвинейский d-13 см лососевый;садоводство;Бальзамин
Бальзамин новогвинейский d-13 см розовый;садоводство;Бальзамин
Бальзамин новогвинейский d-13 см цвет фуксии;садоводство;Бальзамин
Бальзамин новогвинейский d-13 см ярко красный;садоводство;Бальзамин
Банка из стекла для сыпучих продуктов круглой с пластмассовой крышкой и цветной вкладкой 1,0л 10МР-0001;посуда;Банка
Банка РОНДО ВАЛЕНСИЯ 1л, G8494, Luminarc, Китай;посуда;Банка
Банка РОНДО ЭЛИЗ 1л, G8487, Luminarc, Китай;посуда;Банка
Банка с крышкой Attribute 500 мл и бугельным замком JAR500;посуда;Банка
Банка с крышкой Attribute 760 мл и бугельным замком JAR760;посуда;Банка
Банка с металлической крышкой, COLOR SERIES, круглая, 11*11*12 см, 960 мл VALIANT, JK-D960;посуда;Банка
Банка с металлической крышкой, COLOR SERIES, круглая, 11*11*17 см, 1350 мл VALIANT, JK-C1350;посуда;Банка
Банка со стеклянной крышкой, COLOR SERIES, круглая, 10*10*12 см, 300 мл VALIANT, JP-S300;посуда;Банка
Банка со стеклянной крышкой, COLOR SERIES, круглая, 7*7,6*12,5 см, 280 мл VALIANT, JP-S280;посуда;Банка
Банка стеклянная STEEL TOUCH 1700 мл, Attribute, ABS017;посуда;Банка
Банка стеклянная WOODEN TOUCH 1700 мл, Attribute, ABB017;посуда;Банка
Банка стеклянная с крышкой Attribute FLEUR 1350 мл ABF100G;посуда;Банка
Банка стеклянная с крышкой Attribute FLEUR 650 мл ABF135W;посуда;Банка
Банка стеклянная с металлической крышкой и краником Attribute GRAPE 3,8 л ABS038;посуда;Банка
Барвинок синий объем 0,5 л;садоводство;Барвинок
Бархатцы Веселая полянка 0,3 г 4660010777505;садоводство;Бархатцы
Бегония ампельная, диам. 12 см;садоводство;Бегония
Бегония вечноцветущая рассада однолетних цветов в кассете по 10 шт;садоводство;Бегония
Бегония вечноцветущая рассада однолетних цветов в кассете по 6 шт;садоводство;Бегония
Бегония клубневая d-13 см;садоводство;Бегония
Бегония клубневая Красная в горшке d-12;садоводство;Бегония
Бегония клубневая Оранжевая в горшке d-12;садоводство;Бегония
Бегония клубневая рассада однолетних цветов в горшке диам. 12 см;садоводство;Бегония
Бегония Элатиор, цвет в ассортименте;садоводство;Бегония
Бельевые прищепки YORK АЗУР эко деревянные 20 шт z029 G1529;хозяйственно-бытовые принадлежности;Бельевые
Бельевые прищепки YORK Классик 20 шт G96010;хозяйственно-бытовые принадлежности;Бельевые
Бензин для зажигалок, 1205214;хозяйственно-бытовые принадлежности;Бензин
Бидон пластмассовый 4,0 л (Иж) 1401118;хранение и порядок;Бидон
Бидон пластмассовый 5,0 л (Иж) 1401119;хранение и порядок;Бидон
Блюдо Pasabahce серия Конья диаметр 354 мм 54372B;посуда;Блюдо
Блюдце УТРО ЭКЛИПС, J3261, Luminarc, Франция;посуда;Блюдце
Буддлея Вейера в горшке d-12;садоводство;Буддлея
Бузульник Пржевальского кленолистный желтый объем 1 л;садоводство;Бузульник
Бульонница Luminarc МИСТИГРИ 500 мл J8770;посуда;Бульонница
Ваза МАСКАРАД 24 см G5541 Luminarc Франция;посуда;Ваза
Вакуумный пакет EVA для хранения вещей 50х85 см EVEC0085;хозяйственно-бытовые принадлежности;Вакуумный
Валериана лекарственная Кардиола в кассете 4 штуки;садоводство;Валериана
Ванна 70 л оцинкованная г.Магнитогорск, 1301016;ванна;Ванна
Вантуз с деревянной ручкой d14 см красный, Burstenmann, 0522/0000;ванна;Вантуз
Вантуз черный с длинной ручкой (D-110 мм, L-380 мм), 1206007;ванна;Вантуз
Вантуз черный с пластиковой ручкой малый Д-100 (МАГ), 1206002;ванна;Вантуз
Ведро AMPARI РТ9061СЛРОЗ-10РS 12 л сливочно-розовый;хранение и порядок;Ведро
Ведро без крышки Полимербыт Лаванда 9 л 4314108;хранение и порядок;Ведро
Ведро для мусора Hailo 0516-570 16 л, бежевый;хранение и порядок;Ведро
Ведро для мусора Meliconi Любимцы 14 л 5667;хранение и порядок;Ведро
Ведро для ягод Полимербыт 2 л 4311001;хранение и порядок;Ведро
Ведро овальное с отжимом и шваброй моп с черенком Centi, 8 л, высота 22 см, York/7218;хранение и порядок;Ведро
Ведро пластиковое универсальное 12 л цвета морской волны, Leifheit, 52000;хранение и порядок;Ведро
Ведро Полимербыт ГРИБЫ 9 л 4314103;хранение и порядок;Ведро
Ведро резинопластиковое строительное 12,0 л (МП), 1402018;хранение и порядок;Ведро
Веник для подметания из сорго 225 г 2 шва;хозяйственно-бытовые принадлежности;Веник
Веник для подметания из сорго LUX 400-450 г 3 шва 5 колец;хозяйственно-бытовые принадлежности;Веник
Веник сорго с деревянной ручкой с 4-мя швами, Rozenbal, R206204;хозяйственно-бытовые принадлежности;Веник
Венчик с деревянной ручкой (Хохломская роспись) 1522013;посуда;Венчик
Вербейник монетчатый желты;садоводство;Вербейник
Вербена Fuhcsia ярко-розовая объем 0,5 л;садоводство;Вербена
Вербена Red красная объем 0,5 л;садоводство;Вербена
Вербена White Blue сиренево-белая объем 0,5 л;садоводство;Вербена
Вербена ампельная, диам. 12 см;садоводство;Вербена
Вербена ампельная, диам. 21 см;садоводство;Вербена
Вербена крупноцветковая White белая объем 0,5 л;садоводство;Вербена
Вербена микс Wicked Wich смесь окрасок объем 0,5 л;садоводство;Вербена
Вербена рассада однолетних цветов в кассете по 10 шт;садоводство;Вербена
Вербена рассада однолетних цветов в кассете по 6 шт;садоводство;Вербена
Веревка полипропиленовая (фал) d-4 мм, L-20 м, 1201031;хозяйственно-бытовые принадлежности;Веревка
Вероника колосковая микс объем 1 л;хозяйственно-бытовые принадлежности;Вероника
Весы напольные Edition Feet механические;электроника;Весы
Весы напольные механические Дельта D-2017 130 кг, 1205224;электроника;Весы
Весы напольные электронные Soehnle Pino White, 63747;электроника;Весы
Весы настольные электронные DELTA КСЕ-01 белый 5кг;электроника;Весы
Весы электронные кухонные Soehnle (круглые,20 см. стеклянные) серебро 5кг/1гр. 66161;кухонные принадлежности;Весы
Вешалка - слуга Малая ЗМИ белое серебро ВНП 141 б;хозяйственно-бытовые принадлежности;Вешалка
Вешалка Valiant для брюк и юбок металлическая 30*10.5 см 121B11;хозяйственно-бытовые принадлежности;Вешалка
Вешалка гардеробная Радуга 1 ЗМИ белое серебро ВНП 298 бс;хозяйственно-бытовые принадлежности;Вешалка
Вешалка гардеробная Радуга 2 ЗМИ черный ВНП 299 ч;хозяйственно-бытовые принадлежности;Вешалка
Вешалка деревянная для верхней одежды 45 см;хозяйственно-бытовые принадлежности;Вешалка
Вешалка деревянная с расширенными плечиками и перекладиной 44,5х23 см см белый JAPANESE WHITE VALIANT JW-19708;хозяйственно-бытовые принадлежности;Вешалка
Вешалка деревянная с расширенными плечиками и перекладиной 44,5х23 см см серый JAPANESE BLACK VALIANT JB-19708;хозяйственно-бытовые принадлежности;Вешалка
Вешалка для блузок 41 см зеленый Attribute AHM751;хозяйственно-бытовые принадлежности;Вешалка
Вешалка для блузок 41 см красный Attribute AHM781;хозяйственно-бытовые принадлежности;Вешалка
Вешалка для блузок 41 см черный Attribute AHM791;хозяйственно-бытовые принадлежности;Вешалка
Вешалка для брюк Attribute CLASSIC 30 см AHN261;хозяйственно-бытовые принадлежности;Вешалка
Вешалка для брюк Attribute CLASSIC 38 см AHN271;хозяйственно-бытовые принадлежности;Вешалка
Вешалка для брюк металлическая с резиновым покрытием 26 см цвет: синяя, Attribute, AHS331;хозяйственно-бытовые принадлежности;Вешалка
Вешалка для верхней одежды Attribute NEO BLUE 45 см AHS711;хозяйственно-бытовые принадлежности;Вешалка
Вешалка для костюма прямая 44 см красное дерево Attribute AHR141;хозяйственно-бытовые принадлежности;Вешалка
Вешалка металлическая Valiant с четырьмя разъемными перекладинами противоскользящим покрытием 35*30 см 18B30;хозяйственно-бытовые принадлежности;Вешалка
Вешалка надверная Нота 5 ЗМИ медный антик ВНД 310 м;хозяйственно-бытовые принадлежности;Вешалка
Вешалка напольная ATLANT 90х42 см VATL-1 светлая Степанов;хозяйственно-бытовые принадлежности;Вешалка
Вешалка напольная ATLANT бук темная 154-179х90х42 см см на колесиках Степанов;хозяйственно-бытовые принадлежности;Вешалка
Вешалка напольная TWIST складная 45*35 VRTW-1 светлая Степанов;хозяйственно-бытовые принадлежности;Вешалка
Вешалка напольная с подставкой для сумок BLUES темная на колесиках Степанов;хозяйственно-бытовые принадлежности;Вешалка
Вешалка напольная ФАНК ЛК-21 F/LK-21;хозяйственно-бытовые принадлежности;Вешалка
Вешалка настенная НИКА ВН3 3 крючка медный антик;хозяйственно-бытовые принадлежности;Вешалка
Вешалка настенная НИКА ВНТ3 3 крючка черная;хозяйственно-бытовые принадлежности;Вешалка
Вешалка настенная НИКА ВП6с с полкой 6 крючков серебро;хозяйственно-бытовые принадлежности;Вешалка
Вешалка настенная НИКА ВПТ11б с полкой 11 крючков белый;хозяйственно-бытовые принадлежности;Вешалка
Вешалка НИКА Комфорт 6 напольная серебро ВК6с;хозяйственно-бытовые принадлежности;Вешалка
Вешалка с закругленными плечиками без перекладины с противоскользящим покрытием Valiant 226B10 черный;хозяйственно-бытовые принадлежности;Вешалка
Вешалка с закругленными плечиками перекладиной и крючками с противоскользящим покрытием Valiant 213R11 черный;хозяйственно-бытовые принадлежности;Вешалка
Вешалка самоклеющая на 4 крючка 1110008;хозяйственно-бытовые принадлежности;Вешалка
Вешалка-перекладина Valiant металлическая двойная с антискользящим покрытием 50320;хозяйственно-бытовые принадлежности;Вешалка-перекладина
Вешалка-плечики 3 шт без эссенции цвет светло-бирюзовый FWM-002/Aruba blue;хозяйственно-бытовые принадлежности;Вешалка-плечики
Вешалка-плечики без эссенции цвет тёмно-розовый FWM/L-Pink;хозяйственно-бытовые принадлежности;Вешалка-плечики
Вешалка-плечики без эссенции цвет тёмно-розовый FWM-002/Quartz pink;хозяйственно-бытовые принадлежности;Вешалка-плечики
Вешалка-стойка № 9 Дерево ЗМИ медный антик ВНП 211 М;хозяйственно-бытовые принадлежности;Вешалка-стойка
Вешалка-стойка Сакура Авангард венге;хозяйственно-бытовые принадлежности;Вешалка-стойка
Вешалка-стойка Сакура Слуга 2 на колесах сосна;хозяйственно-бытовые принадлежности;Вешалка-стойка
Вешалка-сушилка Gimi Paco;хозяйственно-бытовые принадлежности;Вешалка-сушилка
Вешалки мягкие для деликатных вещей 3 шт голубые;хозяйственно-бытовые принадлежности;Вешалки
Вешалки мягкие для деликатных вещей 3 шт желтые;хозяйственно-бытовые принадлежности;Вешалки
Вешалки мягкие для деликатных вещей 3 шт шоколад;хозяйственно-бытовые принадлежности;Вешалки
Вигна Лилиана в кассете 4 штуки среднеспелая;садоводство;Вигна
Вилка столовая 3 предмета Кокос СВК102;посуда;Вилка
Вилка столовая 3 шт тяжелая серия Сапфир СВWeddel-2;посуда;Вилка
Вилка столовая Better цветной горох BT-C2003E-TD1/D1;посуда;Вилка
Вилка столовая Better цветы BT-C2003E-TD1/D3;посуда;Вилка
Вилка столовая RIPPLE сталь 3 мм, 3 шт, Attribute, ACR013;посуда;Вилка
